{
  "$schema": "https://json-schema.org/draft/2020-12/schema",
  "title": "persona_profile_generation.v1",
  "type": "object",
  "additionalProperties": false,
  "required": [
    "persona_id",
    "space_name",
    "profile_sections",
    "profile_image_path",
    "accountability_summary"
  ],
  "properties": {
    "persona_id": {"type": "string"},
    "space_name": {"type": "string"},
    "profile_sections": {
      "type": "array",
      "minItems": 1,
      "items": {
        "type": "object",
        "additionalProperties": false,
        "required": ["title", "content"],
        "properties": {
          "title": {"type": "string", "minLength": 1},
          "content": {"type": "string", "minLength": 1}
        }
      }
    },
    "short_cv_entries": {
      "type": "array",
      "items": {
        "type": "object",
        "additionalProperties": false,
        "required": ["role", "organization", "period", "description"],
        "properties": {
          "role": {"type": "string", "minLength": 1},
          "organization": {"type": "string", "minLength": 1},
          "period": {"type": "string", "minLength": 1},
          "description": {"type": "string", "minLength": 1}
        }
      }
    },
    "profile_image_path": {"type": ["string", "null"]},
    "accountability_summary": {"type": "string"}
  }
}
